hands, not of a doctor, but of a regular brute...."
than 300 houses at Gerbéviller, 800 at Sermaize, 1,200 at Dinant, 1,800
houses, they confined the two brothers S. in a shed, and the unfortunate
(Saint-Maurice, Meurthe-et-Moselle) was surrounded, and the soldiers
with hand-weapons, bayonets or rifles. The list is a long one. Will the
officer the numbers of the French regiments in the neighbourhood. The
them marching past. No provocation whatever was offered, but an officer
and shot him. They then returned to look for the father, an old man of
whom 71 were women, 34 old men of over seventy, 6 children from five to
entertainment ended with a prayer!
"Captain Hermann was drunk."
half confined--the whole being frightful to look at. Three children
hundred of the clergy were massacred. Note further that in this
Vital was caught in the act of tending a French soldier, L. Sohier by
we got."
or sword than by starvation, as the following incident shows: One
war."[15] They will deny these crimes to-morrow, but in 1914 they
their hands, or waved a white flag, and cried, "Kamerad," pretending to
on the 25th August, men and women were placed in the front rank of the
The cowards chiefly used civilians as shields, but sometimes they also
FOOTNOTES:
their victims, and in others to hold a light for the executioners while
been cattle, and the trucks had been cleaned in a very perfunctory
"Included in the number were the burgomaster of Dinant, a sheriff,
M. Tschoffen, public prosecutor at Dinant, the high official who writes
further. They tied a rope to him, and two horsemen held the ends so that
beaten with the butt-ends of rifles to such an extent that they died of
human dignity and self-respect."[23]
other journeys.
Enquiries conducted by high magistrates have established the fact that
continued their crimes--in order to justify them.
people had not fired a shot. "Shoot me, if you like," he said calmly,
acquaintance of a German officer, who said to him on August 20th, "You
Government towards the Belgian nation: 'He is twice guilty who violates
"making wide use of this new method of warfare,"--a statement contrary
Kant is as sacred as our own hearth and home. We answer for that in our
unite all workmen, the working classes of
ever invented by tyranny for the punishment of
servitude, we shall never give our consent.
consequently free. Nor did he interfere less honourably in that cruel
persecution of numerous individuals.
perfectly devoid of truth.
obliged to hand down with detestation, as far as I am able; and with an
_premeditated murder_ of a slave by any person on board, should
factories, or by a merchant, or by a planter, or by a person whose
replied, that as the publick attention was now excited to the case of
pleasure of being acquainted with many, both in the naval and military
were mentioned in the original copy of my own work, before the
*       *       *       *       *
moderns.--Cruel instance of the Dutch colonists at the Cape.
right of capture, in answer to some supposed objections.--Chap.
employment of the survivors.--The colonial discipline.--Its
ages from the remotest antiquity, in its favour. Here then is an
kind were those, both among the Egyptians and the Jews, who are recorded
so bad a custom is stiled honour. The slaves, thus obtained, are
--Id. 21. 1. 25. &c. &c. &c.]
maxim in their polity, that whoever should fall into their hands as a
"The Grecians,"[009] says Thucydides, "in their primitive state, as well
To this kind of piracy Ulysses alludes, in opposition to the former,
flute. At length the robber, having got the better of the husbandman,
supposed to constitute heroism, to conduct them with success. Upon this
for its preservation. It had been produced in the ages of barbarism; it
Yet such was their general situation: there were two places however,
privilege infinitely greater than the whole of these. They were allowed
will not be difficult to suppose, that they could be held in the same
rest of the world by the title of _barbarians_; inferring by such
they lived? Here would be a second source, from whence we could collect
of expression to be apprehended by the lowest capacities, and, (what is
_Poetry_ of Alcman, which is no _servile_ composition; the
word, which we have translated _senses_, is _Aretae_, or
_possession_.
custom. Thus was Ægypt, in those days, the place of the greatest resort;
infinite number of small and independent kingdoms. There was the same
Deity, which they conceived themselves to have forfeited, by the
The unfortunate Africans, terrified at these repeated depredations, fled
their attention, but excited their curiosity: they dazzled the eyes and
saved those sighs and emotions of pity, which must now ever accompany
But if the African kings could be capable of such injustice, what vices
in chains to the merchants, and consigned to slavery.
Having thus explained as much of the history of modern servitude, as is
that the balls discharged by them will sometimes, as I have been
CHAP. I.
of the poets, which, like other fables of the times, had its origin in
associated only for their defence, so they experienced, at first, no
to the acquisitions of the industrious, and heal the intestine
[Footnote 037: Justin. L. 2. C. 2.]
consider, who first obtained the pre-eminence in these _primoeval
To confirm this reasoning, we shall appeal, as before, to facts; and
could possibly have over his people."
different nations described, in their early state of subordinate
then only be written by tradition and use, as perfect and binding as
topicks, which the experience and studies, and the refinements of civil
government. Notwithstanding this, he is under the necessity of inserting
Neither can men, by the same principles, be considered as lands, goods,
or, in other words, if he, who is called a _master_, can have a
as property. For first, the right to empire over brutes, is
them through life, and this--is all.
understood in every species of government, "that, the power of the
means of violence and oppression; by means, repugnant to _nature_,
first drew their infant-breath: here, that they were cherished and
educated. This regard is particularly conspicuous in the conduct of
consideration in the punishment, it is evident that men bear nothing
in which the Europeans first intoxicated the African princes with their
The law, by which prisoners of war were said to be sentenced to
their own, so their effects followed the condition of their persons, and
injustice of the measure, that the Europeans, after the introduction of
punishment they deserve? Perhaps it will be said, _that they must be
By the first, the Carthaginians were to be free, and to enjoy their own
injured, who took his prisoner, was not the person, to whom the
the community, who should happen to be taken. Now, as the principles of
domarent alios; Bellum neve in Africa, neve extra Africam, injussu P. R.
this amazing distance. Some of them attend the various markets, that are
than of this opinion: he will find, that where _ten_ are taken, he
and both parties fought for about half an hour with the fiercest
favoured their retreat, we stood backwards and forwards, and took up
the preceding, that we should not have mentioned it again, but that we
deny it to be just. The state[051] alone is considered to have been
[053]_nine millions_ of men have been torn from their dearest
above. The author, desirous of a farther confirmation of this
author of the present Essay, with liberty to make what use of them he
it is positively allowed."--But can _laws_ alter the nature of
been sentenced, at last, to a dreadful death for the most insignificant
own climate, yet their situation is frequently uncomfortable, and even
falsehood of your assertions, how many, when on board your ships, have
are awake; who coolly and deliberately equip your vessels; and who spend
the consideration of the _commerce_, we shall now proceed to the
but for a little time, you will see them pass. They were last night
inland country; when one of the petty kings immediately assembled his
where they were all devoured."
belongs, purchased him and two others, by means of their travelling
whom you so justly declaim; are not _Christians_. They are
very atmosphere resound with their prayers and imprecations.
provisions, occasions such a sickness and mortality among them, that not
But this is not the only inhuman treatment which they are frequently
separated from her husband, or the mother from her son: and if these
rattan. The slave soon afterwards fell down, and was raised by the same
every reader of sensibility will anticipate them in his own feelings.
allowance. The excuse which this execrable wretch made on board for his
receivers_, they are conveyed to the plantations, where they are
children, like the progeny of these, become their property _by
supply that is shipped from the coast of Africa, _forty thousand
During the remaining portion of the year, or the time of crop, the
disorders of slaves are contracted from eating the vegetables, which
_as a mark of property_.
beaten and tortured at discretion. They are badly clothed. They are
him to his former master, unless he will consent to live on the mountain
you can, who were the most execrable; the rulers of the state in
lamentation with disinterested people, who out of curiosity have
obligations to obey_, and whose only title to their services consists
unfortunate people to rest at all! feast if you can, and indulge your
20000 to make it free from all objection.]
alternately _every other night_.]
state. The _marshal_, an officer answering to our sheriff,
say, that we have no testimony to produce for any of our assertions, and
particularly where it has been daily indulged in its greatest latitude,
been all forcibly torn from their country, and are retained in their
above all, that the fatal order was put into execution." What would the
to be considered as _robbers_ yourselves, who cause these
consider only as common discipline? Here you say that the Africans are
This assertion is proved by two arguments; the first of which was
genius. They have no hope of riches, power, honours, fame. They have no
that in general, as long as their slavery continues, every obstacle is
abilities are sufficient for their situation;--that they are as great,
having learned with facility such of the mechanical arts, as they have
difference of pronunciation is the cause. Upon the whole, as they are
_From an Hymn to the Evening_[070].
Harmonious lays the feather'd race resume,
Measure the skies, and range the realms above.
thousands of the enlightened Europeans would have occasion to blush.
against African capacity, and from the instances that have been
designed for slavery; and that the reducing of them to such a situation
divine writings from giving any such account, that they shew the
were the objects of the curse, were a totally distinct people: that it
to be more or less numerous or powerful than those, which acted upon the
many people? Where do you live yourself? Do you live in _Spain_, or
The _mulattoe_ is as capable of continuing his own species as his
various climates of the earth, see the colour that generally prevails in
With respect to the Divine interposition, two epochs have been assigned,
impossible to conceive, that they could have wandered and settled in
necessarily have supposed, that, as the _true skin_ was in every
experiments, by which it appears, that, whatever is the colour of this
various qualities of things, which, combined with the influence of the
These are facts[084], which anatomy has established; and we acknowledge
sands_, and to the sulphurous and metallick particles, which are
equator to the poles, but also different[085] shades of the same colour
observed by others.
their degree, by a colder climate.
attention. For when we know to a certainty from whom they are descended;
each other: and yet nothing is more true, than that the _English
Circassian_[095].
contiguous to each other that they should unite, we should then see, in
of colour in the inhabitants of every successive parallel.
Having now replied to the argument, "that the Africans are an inferiour
beings, with such mental qualities and powers, for the sole purpose of
his colour, or the leopard his spots?" Now the word, which is here
for the particular country called _Lybia Proper_, was peopled by the
southward, as I said in my treatise, to the rivers _Senegal_ and
[Footnote 082: The cutaneous pores are so excessively small, that one
must have changed their colour. For had they gone in an Eastern or
These arguments are of a different complexion from the former. They
assertion without a proof. It is not shewn even by those, who assert it,
With respect to the declaration, that the life of an _African_ in
_African_ possesses, and no one, which the defenders of slavery
those, who are employed in the _cultivation of the field_, as long
that, with their weekly allowance, and the produce of their spots
allotted them for sleep; and so far are these dances from proceeding
taken from their country to a region of conviviality and mirth; and that
_a greater relish_? Nor is the assertion less false in every other
such in their own country, that to say they are happy is a jest. "But
the countenance may be cheered with a momentary smile, the heart may be
they have experienced the colonial joys_, constitutes their supreme
slaves were imported within an hundred years; at the expiration of which
_field-negroe_, so long as he can work, is a maxim, which,
If this then be the case, and if slaves, notwithstanding all the
being has a right to sell you, you immediately answer, No; as if nature
been the most abandoned and execrable of men, yet are they perfectly
nature, and the revealed voice of God, what a dreadful argument will
the natural rights of men, and to give a sanction to brutality and
joined with _Tychicus_ in an ecclesiastical commission to the
benevolence, who reduces an unfortunate person _against his will_,
fully established, would be sufficient for the abolition of them all.
to be taken, an _hundred_, including the victors and vanquished,
servitude, which cannot be carried on without the continual murder of so
both of individuals and the nation, must sometime draw down upon us the
deserved them all; that the fear of sympathy, which can hardly be
[Footnote 111: Epist. to Philemon.]
Their tender tears, as o'er the stream they bend;
Descend, ye Spiders, on your lengthen'd threads;
Round the chill fair he folds his crimson vest,
before  the other? See note on Gloriosa, and Genista. The
All the plants of this class, which have naked seeds, are aromatic. The
longer; and that thence in these flowers that the filaments are the most
anthers upon them, called by Linneus eunuchs. The flax of our country
kind. Perhaps all the productions of nature are in their progress to
may be often discovered by the calyx, as in Hepatica, Ranunculus, Alcea.
Miln's Bot. Dict. art. coniferæ. The gates of St. Peter's church at
So hapless DESDEMONA, fair and young,
Magicum, or magical onion, produces onions on its head, instead of seeds.
touched, all the filaments which support the cylindrical anther will
contain the five females, and those which contain the ten males, are
Fritillaria Persica, the six stamens are of equal lengths, and the
Dropp'd on one knee, his frantic arms outspread,
of fly-eater. P. 411. in the Dypsacus is another contrivance for this
affords an agreeable example of _art_ in the vegetable economy, 1. The
_Four_ of the giant brood with ILEX stand,
the leaves and peel off the bark. The bird-lime made from the bark of
Skies burst in flames, and blazing oceans dash;--
bared only in part by the wasting away of the earth by the river, near
And folds her infant closer in her arms;
observed the future flower and foliage in the bulb of a Tulip; and adds,
slower in the spring, and ripen their seeds in the autumn. Miller's Dict.
[_Helianthus_. l. 223. Sun flower. The numerous florets, which
Redundant folds of glossy silk surround
l'Acad. des Sciences for the year 1784. p. 615. after hiving described
the first.
wild pine, grows on other trees, like the Misletoe, but takes little or
Spallanzani's Dissertations, v. II. p. 321. Thus the flowers of the male
285  Rooted in earth each cloven hoof descends,
them from the injuries of cold, like the wool of animals. Those bodies,
Lifts o'er the tossing wave his nostrils bare,
leaflets, which seems to be their most sensitive or irritable part. Now
All wan and shivering in the leafless glade
appearance of vegetables in the spring seem occasionally to be influenced
apertures did not bleed on the 13th of March, when the thermometer was at
340  When Zephyr wafts her deep calash aside;
kind of tapestry, and draws its nourishment perhaps chiefly from the
spoonful to half a pint of water; and serves both for the nutriment of
alternate fortnights with a mixture of madder, and with their usual food
Hence there is apparent design in the colours of animals, whilst those
vessels or parts of our system; hence these cease to act, and collapse
water, and are furnished with an elastic spiral stalk, which extends or
405  Can stars or seas the sails of love retain?
much distended with air; these seem to be analogous to the air-vessel at
circumstance: it is probable the quantity of air he took down with him,
On DOVE'S green brink the fair TREMELLA stood,
Birch-trees; and use the Agiricus officin. for Soap. ib.
440  To guide or light the wanderer on her way.
465  With rush-wove crowns in sad procession move,
improve.
expressing sentiments in the language of vision; and are indeed better
That Hebe was fairest of all that were fair.
contemplation of them as not to perceive their improbability.
in our dreams. First, because in sleep the organs of sense are closed or
_B_. Now to apply.
particularly excells.
scenes of the Tempest we perpetually believe the action passing before
OF THE
--Plume over plume in long divergent lines
Sees, like a map, in many a waving line
Inventress of the Woof, fair LINA flings
The beamy flax, and stretch the fibre-line;
cards_, which move against each other, with different velocities. It is
Chemistry became recorded in written language, though the antient
characters are probably arrived at their perfection, unless emphasis, and
Prints the lone crotchet, and the quaver joins;
Her paper foliage, and her silken flowers;
Vein the green leaf, the purple petal dye:
Her slow nutation, and her varying clime,
The callow nestlings of domestic Bliss.
green, and degenerates into a calyx. See note on Lonicera. The nectary of
Pursue their monarch as he crawls along;
fish, and converted them. Addison's travels in Italy.]
Pant on the floods, inebriate with their zeal,
de Tott.]
Calls up with magic voice the shapes, that sleep
existence in the night. And the flowers of the Hibiscus trionum are said
II.
Emerging Naiads swell'd the jocund strain,
Where Andes hides his cloud-wreath'd crest in snow,
thus were discovered the virtues of this famous drug.]
Where yon aspiring trunks fantastic wreath
Ope their parch'd lips, and spread their eager hands,
Foxglove. The effect of this plant in that kind of Dropsy, which is
Raised the weak head and stayed the parting sigh,
received from all parts of the nation. _Journal of the Plague-year,
Wide o'er these earthly scenes their partial eye,
ball, and should exhibit the bleeding flesh and shattered bone of the
deception: whereas the bitter cup of true Tragedy is mingled with some
if any distressful circumstances occur too forcible for our sensibility,
Shrill scream the famish'd bats, and shivering owls,
kind of divining rod has been used to discover springs of water in a
With wine unbless'd the holy chalice stain,
believe it acts in the same manner as opium and vinous spirit; but that
While with quick sighs, and suffocative breath,
that our nerves of sense are not torpid or inert during sleep; but that
Each in his flinty channel winds along;
Rocks rear'd on rocks in huge disjointed piles
flowing in upon the central fires, and thus producing an irresistable
Listening the Shepherd's or the Miner's song;
cell with five divisions; each of these, when the seed is ripe, on being
obliquity of the points of the feet prevented it from receding. And thus,
Saw her dear babes from fame and empire torn,
Death with black hands extends his mighty Pall;
in the vegetable economy being produced in flowers or leaves to protect
If rests the traveller his weary head,
materials, such as purge, vomit, intoxicate, &c.]
Her shatter'd aqueducts, and prostrate sanes,
Rocks rise on rocks, and fountains gush between;
Or pounce the Lion, as he stalks beneath;
new bulbs; and I suspect the tulip-root, after it has flowered, dies
elongated itself near an inch, and the new bulb was formed above the old
Sought with bold eye amid the bloody strife
295  "Hoarse barks the wolf, the vulture screams from far!
320  And press'd warm kisses on the lifeless clay;
suffocate or incommode shrubs; the parasite climbing plants, as Ivy,
--With brow upturn'd to heaven the holy Sage
which Mahomet observed, and forbade the use of it to his disciples. The
art of distillation, as well as some other chemical processes (such as
Six lovely daughters, and their father, swept
One smiling boy, her last sweet hope, she warms
410  And living plunged amid the festering dead.
a state as to vegetate, when properly taken care of, the fruit of the
the information principally of Capt. Folger. This was confirmed by the
are ascribed to the influence of the Monsoons. It is probable, that in
430  The salt tears mingling with the milk he sips;
Bares his mask'd brow, his lifted hand disarms;
_Bookseller_. Poetry has been called a sister-art both to Painting and to
before our eyes. Does not this resemble one of the arts both of the
it were, to the spectator; this is done in both arts by describing or
reasonable to conclude, that the more artificial arrangements of these
_B._ Will you now oblige me with an account of the relationship between
or iambic verse. Thus the two following couplets are each of them divided
verses.
2/4 A | river or a sea |
and Virgil, except in the length of the lines. B. Then there is no
other. The execution of this idea is said by Mr. Guyot to have been
coincidence or opposition of these _ocular spectra_, (or colours which
than the original.
inferior as is generally believed; since many passages, which have been
beauty to my Botanic Garden:--and such as it is, _Mr. Bookseller_, I now
And bend in air the many-colour'd bow.--
numerous petals of a pure white: it begins to open about seven or eight
Each haunted rill with silver voices rings,
deserves further investigation. See Dictamnus. The ceasing to shine of
[_So shines the glow-fly._ l. 52. In Jamaica, in some seasons of the year,
Fierce flames innocuous, as they step, retire!
grasses, as of wheat, barley, rye, oats, supply food to the human
And teach thy tortured cliffs to howl!
From Time's remotest dawn where China brings
115  Dark waves the fringed lid, the warm cheek glows,
But if sweet Love with baby-fingers twines,
new bulb; and that Lily of the Valley, Convallaria, will produce many
Chase with quick step, and eager arms outspread,
Or strain the bow reluctant to its string.
unknown depths; and might thence afford a passage to steam from great
Bathes his fair forehead in the misty stream,
fibre a place where the resistance to its expansion is less; and in
similar material. As the material thus necessary to life seems to abound
That the natives dry it in the sun, and take the pulp out of it, which
220  And feeds and freights the immeasurable waves;
those patients quickly recover by the use of fresh provisions; and is
235  So with pellucid studs the ice-flower gems
And shrieks of Anguish bellow in the wind.
which I suppose the honey to be prepared. See note on Helleborus. I am
Next with soft hands the knotted club she rears,
Sibthorpia Europæa to have for its parents the golden saxifrage and marsh
On quivering pinion woos the Queen of flowers;
always attended with a fog or haze, so dense as to render those objects
covered most parts of Europe for many weeks in the summer of 1780, which
supposed to have been caused by the great evaporation, and the deficiency
There are many other instances of spontaneous movements of the parts of
And ever and anon with hideous sound
365  In vain her eyes the parting floods explore,
shoot out numerous stoles or scions underground; and this the more,
seed-vessel, but a receptacle inclosing the flower within it. As these
fig-flowers, which are closed on all sides in the fruit or receptacle
Waked into life beneath its parent's breast,
The star of Venus gilds the twilight wave,
To win the fair he tries a thousand forms,
an animal similitude. Phil. Bot. p. 87. See note on Iris in additional
tree, indeed, ought to be considered as a family or swarm of its
480  And seal with muttering lips the faithless vow,
P. 7. _Additional note to Curcuma._ These anther-less filaments seem to
