happens which requires evacuation, you may use a cupping glass, with
up nature and sends it forth. And sometimes it happens that the vessels
broth of a chicken or veal, sodden with oil, or with the decoction of
their meat, they may take green ginger, candied with sugar, and the
anoint them with the fat of hens, geese or ducks, or with oil of
thereof, if she begins to feel any more than ordinary pain let her use
others on the contrary affirming it; but experience has testified there
_Of the Secundine or After-birth._
a membrane, say it is white, soft and exceedingly thin, and just under
womb to the _alantois_. I now proceed to
they enwrap the seed round like a curtain. Soon after this (for the seed
SECT. III.--_Of the manner of the Child's lying in the Womb._
thighs folded, and a little raised, to which the legs are so raised,
if there be twins; for then, by their different motions they do so
for, from the time of the conception to the time of her delivery, she
for granted without further inquiry (for some such there are), and so
infant's head lying in the birth, which, by often thrusting, causes
away, then the midwife may be assured the birth is very near, this being
discover the part which presents itself (as we have said before),
ready to be born, has no more need of the mother's blood for its
not be near so long. Let not the labouring woman be concerned at those
coming forward let her hasten to assist and deliver it, for it
about the middle, next to the skin. These things are mentioned by
two drachms of the powder, cinnamon a drachm, saffron half a scruple,
child comes to the birth the right way, and yet the birth be retarded;
changed according to the exigency requiring it, so that the woman may
inward orifice of the womb putting her finger ends into the entry
strings, both which are of bad consequence to the woman, whose delivery
till the woman be delivered of all the children she is pregnant with.
the effect of their ignorance; for when a child is born with such a
the opinion of these midwives, and he, therefore, ordered the navel
squeeze out of the vessels, but care must be taken, not to knit it so
always observing, for the greater facility, to draw it from the side
(4) Tansey, and the stone aetites, applied as before directed, are also
SECT. IV.--_Of Laborious and Difficult Labours and how the Midwife is
those difficulties that occasion hard pains and labour, is to show first
firm, and will not open, which very much endangers the mother and the
mother's being too young and too narrow, she must be gently treated, and
and a little wine with a toast in it. If she fears her pains, let her be
presently after; or else, by the breaking of the waters too soon, the
danger to a mother and great care ought to be taken therein; but before
Now, if upon trial it be found the child is dead, let the mother do all
dissolved in wine, ox-gall, each two drachms. Or make a fume with an
themselves. (3) When either of the sides, or, (4) the feet present
persons, there must be others also to support her under her arms, that
it by the feet; but the head being a part round and slippery, it may
hand into the womb, to fetch the child by the feet and bring it away.
I know indeed in this case it is the advice of several authors to change
draw it forth with the other; but of this she must be specially careful,
on that side it most inclines to, till it be turned with the face
great difficulty, it being extremely slippery, by reason of the place
helping to conduct it with his left hand; but when he hath brought it
open as long as the womb is distended, which the head causeth while it
To this purpose, therefore, place the woman so that her buttocks may be
to avoid as much as possible the bruising the face.
SECT. VI.--_How a Woman ought to be delivered, when the Hands and Feet
turned about before it can be drawn forth; but in this they are ready,
therefore, much better in these cases to bring it away immediately by
birth together, the one being generally more forward than the other; and
to find the feet, and so draw forth the second child, which will be the
finds they both belong to one body; of which being thus assured, he may
indifferently warm, having first taken away the closures (which were put
womb.
agitated from side to side during the pains of labour, by the throes
4. Let her be careful to keep her belly warm, and not to drink what is
morning in wine, are an extraordinary remedy.
often occasioned by the violent distention and separation of the
had, and by reason of the heat it requires, and the too long stay it
good to scatter and dissipate the milk.
CHAPTER VIII
fresh butter; also give the child for this purpose a little syrup of
to accustom him to keep upon his feet, who otherwise would go upon all
blood with which it was nourished in the womb, but because the stomach
the belly.
of these means, the infant will gradually recover strength, and begin to
which makes the closure, the operation is very easy, and the children
_Operation_. Let the operator, with a small incision-knife that hath but
cool diet, bleeding and purging her also, if there be occasion.
applied to the inflamed parts; therefore let the parts be bathed in
nourishment.
inflamed by watching, pain and heat. And the longer teeth are breeding,
gums are inflamed, add juice of nightshade and lettuce. I have already
voided, and there be wind, belching, and phlegmatic excrements, or if
come from the worms, give such things as will kill the worms. If there
made good my promise to the reader, I am now come to treat only of those
the act of generation, or else it will be spiritless and dull; for if
requires, they may as well let it alone; for frigidity and coldness
conception, by reason of the forcible injection of the seed.
very weak in their bodies, seeing their whole body is deprived of the
break at all, which bring on disorders that end in death.
When unnatural humours are engendered, as too much phlegm, tympanies,
party is barren, whether it be the man or the woman; this is a certain
and by a sympathetic quality, removes any disease thereof. To which add
all, I recommend this medicine to you. Take comfrey-leaves or roots, and
let cinnamon be a spice used in all her meats and drinks, and let her
Take broom flowers, smallage, parsley seed, cummin, mugwort, feverfew,
of bulls, bucks, rams and bears, also cocks' stones, lambs' stones,
roots, eringo roots confected, ginger connected, etc. Of fruits, hazel
_The Diseases of the Womb._
hypochondriacal, and for the most part barren, having sometimes a
proceeds from a too cold air, rest, idleness and cooling medicines. It
overcome, and which either flows thither from other parts, or is
bleed, because it is from a cold matter; but if it come after
flow from the whole body, or are gathered into the womb. Now the vessels
oil of rue, lilies, dill, etc.
dries more than it moistens. Now, if there be a little tumour, within or
other, for eight or ten days, and make a pessary in the form of a pear,
qualities, as rice, starch, quinces, pears and green cheese; but let the
quality, it is as pure and incorrupt as any blood in the veins; and this
order of nature be broken, it shows the body to be out of order. Of each
stoutness of the passage, and weakness of the expulsive faculties.
the papa are very sore.
it. The months of March, April and November, are the three chief months
drawn from divinity, and it is derived from the goodness of God, who
choler by the nose, and of phlegm by the hair, which is the opinion of
often curled hair, as also Ethiopians and choleric men. But the cause of
away, so much the more doth the humour remaining draw to the same; and
that the whiteness doth follow, which is called grayness or hoariness.
Q. Why is not the head fleshy, like other parts of the body? A. Because
Q. Why cannot a person escape death if the brain or heart be hurt? A.
purge them: and, in the absence of the sun, those humours become dark
the force of seeing dispersed in two eyes, the one being shut, is
is moist above all parts of the body, and of a waterish nature; and as
which doth ascend into a woman's head; and she, having pain in her head,
but this doth not, in black or white colours, because these colours do
have been known to come five hundred miles after dead bodies.
sneezing than provoke it.
wings; and partly they are hairy and seem to be of the nature of mice,
speak but little, and hear and see much. And by hearing and the light we
in fashion, which is fittest for that purpose.
from whence it returns and they chew it again, then it goes into the
tongue, whereof heat is engendered, which doth make this superfluity
and foam? A. Because then the lights and heart are in greater motion of
dissolves and consumes superfluous humidities, and by this humidity
Q. Why have some persons stinking breath? A. Because of the evil fumes
Q. Why doth the voice change in men at fourteen, and in women at twelve;
_Of the Neck._
Q. Why is the neck hollow, and especially before, about the tongue? A.
help to the aforesaid grief.
Q. Why do the paps of young women begin to grow about thirteen or
superfluity engendered, there is much milk; because it is nothing else
phlegmatic.
that lives and the last that dies; and when that bone is broken, fish
and because the heart is earthly the thrusting and moving ceasing, its
having two receptacles, viz., the right and the left the right hath more
which, being infected and corrupted, the heart faileth on a sudden;
it, and comes from the parts adjoining, that is, the liver and the
hindered; for in the first digestion is the beginning of the infirmity
Q. Why do we desire change of meals according to the change of times; as
disposed, and fortifies and strengthens the natural heat, causing the
have no gall in one place, as in a purse or vessel, yet they have one
natural in them to get their like.
open, and the heat dispersed through the body: for after bathing, it
Q. How, and of what cometh the seed of man? A. Some philosophers and
first sanguine, the second choleric.
is so very slowly that it grows cold and unfit for generation.
which is best, and always intendeth to beget the male and not the
in the end, through the evil disposition of the matter, not being able
Q. Why do children born in the eighth month for the most part die
into a thick substance of blood. But in the twelve days following, this
Because the tongue, being full of pores and spongy, receives more
Q. Why have birds their stones inward? A. Because if outward, they would
Q. Why do some dream in their sleep that they are in the water and
retaineth that which he hath conceived; is shame-faced, given to music,
proceedeth from the humidity that is in them.
upon and cover the heart, which is on that side under the pap; now the
Q. Why is not new bread good for the stomach? A. Because it is full of
the body by the gestures.
Q. Why is it esteemed, in the judgment of the most wise, the hardest
copulation, and are often barren? A. Because the seed of such goeth to
mind are much delighted, and stick and rest immoveable in the same.
comprehend any dreadful matter, the blood runneth to the internal parts;
legs of beasts are not so? A. Because men only go upright; and therefore
All humours, phlegm excepted, when heated above measure, do seem black
the like happens in tubs or earthen vessels when new wine is put into
in the manner of earthen vessels, which, when they are overheated or
they have moist excrements by reason of their often drinking.
be mingled; neither if it be put on the earth can it enter into it.
when taken after connexion.
water is divided.
flesh rotting, withering and falling away, that which was hidden about
through those small pores the hair doth grow.
age? A. Things learned in youth take deep root and habitude in a person,
Q. If water do not nourish, why do men drink it? A. Because water
places that are above their hips, in which the young fruit would remain.
places, and as it were, soft, yielding to the stroke, and dissolving it,
much light do keep that silence; some say the windpipe doth close
full of sinews, and that herb is of a contrary nature.
seven planets but also of the twelve signs of Zodiac; and the
the artist how to pass a judgment. For according to the sign or planet
third part to a woman.
is commonly wise or a very great fool, or else as very a knave as he is
curled not too much nor too little, is a well-disposed man, inclined to
good wit and very apprehensive. He whose forehead is long and high and
it shows the person to be hard-hearted, envious, close, cunning,
credulous, liberal to others, and even in his conversation. He whose
extended, the tip of it bending downwards, shows the person to be wise,
malicious. He whose nose is naturally more red than any other part of
somewhat reticent, but faithful, secret, modest, bountiful, and but a
chewing, and thin, denotes the person to be envious, gluttonous, bold,
A loud and shrill voice, which sounds clearly denotes a person
reasonably full of flesh, shows a person to be of a good understanding,
mild and obedient, whereas a woman of a more hot constitution is quite
his conversation. A little and round face, shows a person to be simple,
its parts, and which is delightful to look upon, is commonly the index
crooked gullet is generally a man of apprehension, wise, secret,
throat be so thin and lean that the veins appear, it shows a man to be
that is very credulous and apt to believe anything. He whose arms are
appears, as there sometimes does. When the stars appear in this line, it
are found in it, they denote the person prudent and liberal, a lover of
it be winding, crooked and bending outward, it draws deceit and
As for the lines of the wrist being fair, they denote good fortune; but
creatures have pendant behind. Now a great calf, and he whose legs are
full of cross lines, are yet worse in every degree. Those, the skin of
back, he is for the most part of a double heart, and very mischievous.
is not much when discoursing with any one, is for the most part wise and
easy of belief, but very long before he will forget an injury. He who is
significations are as follows:--
and I withdrew, without expecting her reply.
of the vigour of fifty-five, declares for a friend and ratafia; and let
prejudice, and think that she who does not refuse âem everything can
MIRA.  Has the tailor brought Waitwellâs clothes home, and the new
FAIN.  Faith, I am not jealous.  Besides, most who are engaged are women
more agreeable.  Iâll tell thee, Fainall, she once used me with that
FAIN.  Yes; he is half-brother to this Witwoud by a former wife, who was
small wit: nay, Iâll do him justice.  Iâm his friend, I wonât wrong him.
WIT.  Oh, pardon me.  Expose the infirmities of my friend?  No, my dear,
COACH.  Three gentlewomen in a coach would speak with him.
PETULANT, MIRABELL, FAINALL, WITWOUD, BETTY.
PET.  Ay, Roxolanas.
PET.  Enough, let âem trundle.  Anger helps complexion, saves paint.
PET.  Why, thatâs enough.  You and he are not friends; and if he should
FAIN.  Why do you think so?
MIRA.  You do?
PET.  Enough; Iâm in a humour to be severe.
MRS. FAIN.  Then it seems you dissemble an aversion to mankind only in
Methinks you look a little pale, and now you flush again.
fire.  I have seen the warm confession redâning on your cheeks, and
friendship to her, and could not see her easy nature so abused by that
descended to my wife.  And wherefore did I marry but to make lawful prize
forbearâI believe you; Iâm convinced Iâve done you wrong; and any way,
MIRA.  You should have just so much disgust for your husband as may be
MIRA.  Waitwell, my servant.
MIRA.  That was by Foibleâs direction and my instruction, that she might
WIT.  As a physician of a good air.  I cannot help it, madam, though âtis
was I so long?
MILLA.  Oh, the vanity of these men!  Fainall, dâye hear him?  If they
mortification: for, sure, to please a fool is some degree of folly.
MIRA.  I would give something that you did not know I could not help it.
MIRA.  That I believe.
MIRA.  Stand off, sir, not a penny.  Go on and prosper, Foible.  The
man forget himself.  The difficulty will be how to recover my
hear, sweetheart?  An errant ash colour, as Iâm a person.  Look you how
thatâs always breeding.  Wench, come, come, wench, what art thou doing?
LADY.  Oh, he carries poison in his tongue that would corrupt integrity
in his wine.  Iâll send for Robin from Locketâsâimmediately.
you, and now a little of the same art must make you like your picture.
apprehension of offending against decorums.  Oh, Iâm glad heâs a brisk
between your ladyship and Mr. Mirabell might have hindered his
MRS. FAIN.  Iâll go with you up the back stairs, lest I should meet her.
comes the good lady, panting ripe, with a heart full of hope, and a head
comes back, and has acquired discretion to choose for himself.
liberty of choosing oneâs acquaintance as one does oneâs clothes.
decayed beauty, or a discarded toast:âMincing, tell the men they may come
I had the vanity to think he would obey me, I would command him to show
thought makes me melancholic.âNow Iâll be sad.
Loveâs but the frailty of the mind
MRS. MAR.  I perceive your debates are of importance, and very learnedly
one for that.
who are these gallants?
WIT.  Petulant, speak.
information of my boots, sir, if you will step to the stable, you may
WIT.  Odso, brother, is it you?  Your servant, brother.
last nightâs debauch.â  Ods heart, and then tell a familiar tale of a
LADY.  Oh, heâs a rallier, nephew.  My cousinâs a wit: and your great
MRS. MAR.  Iâll follow you, madam,âbefore Sir Wilfull is ready.
to my horns by that increase of fortune: I could have worn âem tipt with
MRS. MAR.  Iâm sorry I hinted to my lady to endeavour a match between
have belief, let it corrupt to superstition and blind credulity.  I am
LADY.  Have you pulvilled the coachman and postillion, that they may not
to advantage, and furnishes with blushes and re-composing airs beyond
companyâ
MILLA.  [_repeating_]:â
SIR WIL.  Well, well, I shall understand your lingo one of these days,
MILLA.  Ah!  Idle creature, get up when you will.  And dâye hear, I wonât
intimate with fools, because they may be your relations.  Come to dinner
MIRA.  _Item_, I article, that you continue to like your own face as long
toast fellows; for prevention of which, I banish all foreign forces, all
MILLA.  Well thenâIâll take my death Iâm in a horrid frightâFainall, I
SCENE VII.
MRS. FAIN.  So, is the fray made up that you have left âem?
PET.  Look you, Mrs. Millamant, if you can love me, dear Nymph, say it,
Prithee fill me the glass,
That heâs able next morning to light us.
commonwealth, thou beastly pagan.
SIR WIL.  Ahey!  Wenches?  Where are the wenches?
SCENE XII.
labyrinth of love,âyou have the clue.  But as I am a person, Sir Rowland,
chastity and odour.
WAIT.  Fie, fie!  What a slavery have I undergone; spouse, hast thou any
FOIB.  By heaven!  Mrs. Marwoodâs, I know it,âmy heart achesâget it from
WAIT.  Hereâs a villain!  Madam, donât you perceive it?  Donât you see
WAIT.  And may I presume to bring a contract to be signed this night?
LADY.  Out of my house, out of my house, thou viper, thou serpent that I
defend myself?  O madam, if you knew but what he promised me, and how he
FOIB.  Oh, that ever I was born!  Oh, that I was ever married!  A bride?
MRS. FAIN.  Was there no mention made of me in the letter?  My mother
but a book of poems.  So long as it was not a bible oath, we may break it
lose such a vast sum as six thousand pound.  Oh, come, Mrs. Foible, I
by groves and purling streams.  Dear Marwood, let us leave the world, and
MRS. MAR.  My friend, Mrs. Fainall?  Your husband my friend, what do you
SCENE V.
of an obscene play-bookâand can I think after all this that my daughter
LADY.  Ay, ay, I do not doubt it, dear Marwood.  No, no, I do not doubt
her maintenance depend entirely on my discretion.
shall be done with all possible speed.  In the meanwhile I will go for
that passed between Mirabell and me, I have obliged him to make a
MRS. MAR.  This is precious fooling, if it would pass; but Iâll know the
turning from me in disdain, I come not to plead for favour.  Nay, not for
fellow-traveller and âtis dissolved.
absolutely make over my wifeâs to my sole use, as pursuant to the purport
shall not be wronged in this savage manner.
FAIN.  If it must all come out, why let âem know it, âtis but the way of
have suspectedâshe did, I say, by the wholesome advice of friends and of
now designs to prosecute his travels.
Truth, cursed be they, and the craft they use
Wouldst thou be pleasant, yet be far from folly?
{10} As I walked through the wilderness of this world, I lighted
frenzy distemper had got into his head; therefore, it drawing
pointing with his finger over a very wide field, Do you see yonder
can by no means be; you dwell, said he, in the City of Destruction,
with us or no?
PLI. Well, neighbour Obstinate, said Pliable, I begin to come to a
here, tell me now further what the things are, and how to be enjoyed,
PLI. This is very pleasant; and what else?
CHR. The Lord, the Governor of the country, hath recorded that in
If we have such ill speed at our first setting out, what may we
he drew him out, and set him upon sound ground, and bid him go on
so be, it might have been mended, but it is the Slough of Despond
hap was to meet just as they were crossing the way of each other.
but that slough is the beginning of the sorrows that do attend
where there are houses now stand empty, one of which thou mayest
heavier to him than while he was in his way.  There came also
take pleasure in them as formerly.
of the Most High, and to draw back thy foot from the way of peace,
consider to whom he sent thee, and also how unable that person was
that was all the while treading on forbidden ground, and could by
{61} CHR. Here is a poor burdened sinner.  I come from the City of
CHR. Now I begin to reap the benefits of my hazards.
Wherefore, getting out again on that side next to his own house,
the death of many more; it is well you escaped being by it dashed
from the wrong, the right only being straight and narrow.  [Matt
therefore speak with the master of the house.  So he called for the
[Gal. 4:19], and nurse them himself when they are born.  And whereas
was swept and cleansed with pleasure.
that is until the next world, for their portion of good.  That
CHR. Then I perceive it is not best to covet things that are now,
he did also continually cast, but secretly, into the fire.
enter therein; he saw also, that in the doorway stood many men in
led him into a very dark room, where there sat a man in an iron
MAN. I left off to watch and be sober.  I laid the reins, upon the
chaff, and stubble, and cast them into the burning lake.  [Matt.
till it came to the mouth of the sepulchre, where it fell in, and
Nor could aught ease the grief that I was in
they lay down to sleep again, and Christian went on his way.
{100} To this they made him but little answer; only they bid him
not in at the gate.
Than wrong, though easy, where the end is woe."
and read therein to his comfort; he also now began afresh to take
shall I fly to be safe?  If I go back to mine own country, that
renewed his sorrow the more, by bringing again, even afresh, his
it up in his bosom, gave thanks to God for directing his eye to the
I see the dangers that Mistrust and Timorous were driven back by.
and security of pilgrims.  The porter also asked whence he was,
according to the rules of the house.  So Watchful, the porter, rang
pilgrims in.  Then he bowed his head, and followed them into the
CHR. It was as God would have it; for when I was under the fears
came a venturous man and cut his way through the armed men that
irons upon their heels; but do you think I could awake them?  I
I look into the roll that I carry in my bosom, that will do it;
CHR. Then Christian wept, and said, Oh, how willingly would I have
apprehension of the judgement that did hang over our heads; but
neighbour.
such a lover of poor pilgrims, that the like is not to be found
Christian had a view; as of things both ancient and modern; together
{137} Then I saw in my dream, that on the morrow he got up to go
{139} CHR. Pray, did you know him?  said he.
{141} Then I saw in my dream that these good companions, when
with a disdainful countenance, and thus began to question with him.
art like to meet with in the way that thou goest.  Thou knowest
to be rid of thy burden, whereas thou shouldst have stayed till
{150} And with that he threw a flaming dart at his breast; but
{155} Now, at the end of this valley was another, called the Valley
and went as far as we durst; and indeed we were almost past coming
and Christian went on his way, but still with his sword drawn in
Thy way to heaven lies by the gates of Hell;
almost at him, he cried out with a most vehement voice, "I will walk
were in this valley as well as himself.
the dangers of his solitary way; which dangers, though he feared
has been dead many a day; and as for the other, though he be yet
spirits, that we can walk as companions in this so pleasant a path.
fire and brimstone from above; and therefore I have made my
CHR. Had you no talk with him before you came out?
