"Length nineteen or twenty inches: bill three inches, stout and of a pale
near the tips: the bill is of a dull red: the forehead very pale, nearly
WATTLED BEE-EATER. Order II. Pies. Genus XXVI.
and channelled on the sides; the colour pale brown, inclining to yellow
This bird was killed at Port Jackson, and we believe it to be hitherto
f. in.
artificers taken from the ships of war and transports were to be paid for
Government held out to those who should wish to remain in either
James Manning, as a soldier.
Number of Persons victualled.
Total of convicts under medical
There is no danger in going up the harbour to Rio de Janeiro but what may
The whole harbour, as well as the town, is defended by a number of strong
those they got on board the Supply were of the snapper kind, and very
form of a crescent, the convex side towards the north-east. Two points at
England, he went on board the Vanguard, Commodore Swanton, to the West
This summary recapitulation of Mr. Shortland's services sufficiently
an unknown sea perplexed with islands, where they were destitute of
continued so for two days, with the same heavy swell, which made it very
Lieutenant Shortland, having now lost sight of the Prince of Wales and
went on board the Alexander, and Carteret's harbour in New Ireland, was
course. On receiving this intelligence he immediately brought to, with
appeared to be at the distance of about thirteen or fourteen leagues, and
these points were joined together by a low neck of land covered with
standing under an easy sail all night. Some islands lying close to Cape
Nor was the mistake detected till they approached it within three or four
rather troublesome to chew, besides three or four kernels not unlike
was tied upon the head. Lieutenant Shortland was desirous to purchase one
Treasury Isles; they are moderately high and seemed to be well clothed
be proved, will not detract at all from the merit of the latter
John George Shortland. The only places in which Lieutenant Shortland
are sufficiently accurate for the direction of any future navigators; as
even in port, or would have been driven adrift again, from total
all the efforts that could be made to counteract the malignity of the
founded and found thirteen fathoms, with a fine sandy bottom, and a
almost out of sight before he was distinguished. Notwithstanding the
[* This was the Chinam, or coral, burnt to lime, always used with the
Alexander being in great danger of driving with the current upon the
provided with provisions. In this melancholy state of both ships, the
T. G. Shortland, second ditto.
James Craven, Seamen.
5th.
Never, perhaps, did any ship arrive in port more helpless, without being
Alexander arrived, on the 18th of February, 1789, had been in Table Bay
[Table not included in this ebook]
the afternoon and night they stood off and on, and at nine o'clock the
miles, both in a south-east and south-west line; those to the south-west
[* Ball's Pyramid.]
From the mean of all their observations they found this island to be
rocks, over which the water flows, without the least opening for a boat;
standing to the eastward with a moderate breeze at south-west. Macaulay's
south-east trade wind, and as the people were in a very weak condition,
for them to come into the bay. When anchored they had only three men in
of the Resolution and Discovery from the islands, landed in the night at
between the men of Uliatea and those of Huaheine, in which the former
great authority; but whether or no she was his wife they did not learn,
plenty, but they were all cocks, and old; the natives likewise brought
purchased at very reasonable rates, nor were the first prices given,
crews of the Resolution and Discovery; nor were the women so free from
he was a constant visitor, and daily brought on board a supply of ready
very light winds, and those westerly, which prevented their reaching the
that he frequently visited Uliatea, and never went empty handed, so that
yams and sugar cane, and the wind coming to the eastward (which had not
longitude.
that they found Captain Byron's account of them perfectly just. On coming
time, the well not affording more than three tons a day, sometimes only
May 1788 to September 1788
quantity of fine birds, sufficient to serve the ship's crew three days;
broadest part; it is very high, and was entirely covered with birds of
northward is very uncertain, though doubtless to a considerable distance,
island made its appearance, which Captain Marshall named Woodle's Island,
harbour at Hopper's Island.
made of raw-silk, neatly sewed together, and are cut in the form of our
scurvy; however, he prudently declined taking this step, as it certainly
along shore, they found it to consist of six different islands, extending
found it to be a chain of islands, extending from east to nearly west for
waist: their ornaments were necklaces made of beads, to which a cross was
breeze, Captain Marshall run in with the land, and found it to be a
leagues distant, but night coming on they wore and stood to the
laid up with the scurvy, and the rest of his crew were so weak that they
determined to get away the moment the wind shifted to south or south by
having a mixture of yellow in various parts of it. We have been informed,
This bird is somewhat smaller than our European species, measuring only
half way, which are not so well feathered as the rest; whereas in the
This beautiful bird greatly resembles the purple Gallinule in shape and
that of the fox: the teeth are much the same as is usual in the genus, as
end of the tail, about forty inches: in the mouth are a few weak teeth,
to say with certainty to which it belongs, as it is deficient in the
were divided, the upper part much longer than the under.
spots, of an irregular shape, most of them dark within; one row passes
British work.
callous like a hoof. This mistake was occasioned merely by the adherence
When the portrait was finished, and O'too was informed that no more
* * * * *
nights constantly brought on tremendous thunder, lightning, and rain. The
erect: the coat or fur is of a much richer texture or more delicate than
found in plenty, it might probably be thought a very valuable article of
Allen, Susannah Ditto 18 April, 1787 7
Bazley, John Exeter 12 Jan. 1785 7
Blunt, William London 10 Decem. 1783 7
Bradford, John Ditto 9 Jan. 1786 7
Castle, James London 7 July, 1784 7
Cormick, Edward Hertford 2 March, 1786 7
Cullen, James Bryen Ditto 6 April, 1785 7
Davies, Mary Shrewsbury 12 March, 1785 7
Edwards, William
Forrester, Robert Ditto 10 Sept. 1783 7
Gordon, Daniel Winchester 5 April, 1785 7
Haines, Joseph Gloucester 13 July, 1785 7
Headington, Thomas Abingdon 7 July, 1785 7
Holloway, James Ditto 24 Aug. 1784 7
Jackson, Hannah Bristol 27 July, 1785 7
Johnson, Mary Ditto 26 April, 1786 7
Leary, John Winchester 3 March, 1783 7
M'Lean, Francis Guildford 11 August, 1784 7
Mather, Mather Ditto 18 April, 1787 7
Morgan, William Ditto 15 Septem. 1784 7
Okey, William Gloucester 24 March, 1784 7
Parry, Sarah Ditto 10 Jan. 1787 Life
Power, William
Richards, John, alias Williams Winchester 2 March, 1784 7
Ryan, John
Smith, William Ditto 10 April, 1783 7
Strong, James Dorchester 10 March, 1784 7
Thackery, Elizabeth Manchester 4 May, 1786 7
at the _Rose_ in _Ludgate-street_, and C. KING
but by your self: and which so far indearâd itself to me, by her
The Method I have used, is neither entirely new, out of a Fondness
and such others as have been called Patriots, had wanted their Praise,
incomparable Treasury of _Northern Literature_ in so cold and
Unreasonableness and unwarrantable Contradiction of their Disbelief?
Words of any Language, be needful towards knowing the Propriety of any
apparent in Etymology; nor do they think those Men competent Judges to
_Rochester_, with many other Divines of the first Rank.]
because, as I have before observâd, it must be very difficult to
compounded, and well sounding Words, and variety of Numbers, are by
Variety of _Monosyllables_ may be always justly reputed a fault, and
Hom. Il. 1. l. 70.
And _Horace_, while he is teaching us the Beauties in the Art of Poetry,
cruel necessity of mangling and tearing them asunder. Mr. _Dryden_,
It is plain from these last Words, that the Subject-matter,
Labour at random, yet was he not wanting in his Generosity to such as
his time, as this Island hath produced, I will with due Veneration for
And as he chase it fyl him for to have.
bÄ±áµ¹áµ¹enáµ¹um Ã¦êbêÃ¦êº. He through his Counsel and Commission rescued
#For _Chaucer_ that my Master was and knew
Where as thou camâst unto the Word of Love,
Among the which the merrie Nightingale
And a little after,
Use is the Judge, the Law, and Rule of Speech,
But having thankâd these noble Lords for their Suffrage, we will proceed
Again,
appear, thus speaking of Mr. _Cowley_;
_Scotch Poem_, inscribed the _Nut-Brown Maid_, shew how great a Master
and _Friendship_,
But shew how all things do your Virtues court.
more gentle Strains. I speak not this, upon Confidence of any Judgment
some Ballast, and some valuable Loading in them, which may be
as common Sense, or to know how to express their Minds intelligibly.
Age, and comes nearest the great Originals of _Greece_ and _Rome_, by
_Philosophical_ Matters, required to such a Work. And particularly,
Ensigns of St. _George_, I cannot doubt of that help, that true
the _Old Northern Learning_, so is it the more remarkable, in that it
facsimile reproductions) of rare seventeenth and eighteenth century
7. John Gayâs _The Present State of Wit_ (1711); and a section on Wit
(1712); and Arthur Mainwaringâs _The British Academy_ (1712).
23. John Drydenâs _His Majesties Declaration Defended_ (1681).  [15074]
*Sixth Year (1951-1952)*
[in preparation]
The Right Hon. the Earl of Grosvenor
The Right Hon. the Earl of Hopetoun
Mr. Philip Hurlock, jun.
Reverend Dr. Kippis
Morris Morgann, Esq.
George Peters, Esq.
Mr. J.C. Robarts
Captain Sidney Smith, of the Royal Navy
Mrs. Twisden
Reverend Mr. John Wesley
CHAP. V.
which in a high degree excite either admiration or pity: all others
and wealth, the richness and cultivation of the soil, the power of its
judges and senators were thus marked; my father had long born it: I
purpose, while he declares she is thenceforth to be looked upon as his
division contains the married men, who in their dances frequently
same manner, as those in Turkey[C].
fragrance: the other a kind of earth; a small portion of which thrown
floors also of these are generally covered with mats. Our beds consist
esteemed a great rarity, as our waters were only brooks and springs.
The benefits of such a mode of living are obvious. The West India
two wherein this happened. This common is often the theatre of war;
warriors, and march boldly out to fight along with the men. Our whole
household. Some of these slaves have even slaves under them as their
the scene.
in our language, signifies vicissitude or fortune also, one favoured,
were held in great reverence by the people. They calculated our time,
impulse, and ran to and fro unable to stop themselves. At last, after
in my favour.
retaliation obtained almost universally with us as with them: and even
smattering of the Portuguese language.
benevolence to others, and gratitude to God, "who hath made of one
West Indies in the year 1763. I then belonged to the Charming Sally,
nigh. One day, when all our people were gone out to their works as
lay clasped in each other's arms. It was in vain that we besought them
also remarked where the sun rose in the morning, and set in the
thought I had run away, and the whole neighbourhood was raised in the
accommodate the merchants and travellers, who lay in those buildings
again torn from me for ever! I was now more miserable, if possible,
centre of the town, where the people washed. Here I first saw and
ours so nearly, that we understood each other perfectly. They had also
particulars. I was very much struck with this difference, especially
water, dive to the bottom, come up again, and swim about. Thus I
too differing so much from ours, their long hair, and the language
least glimpse of hope of gaining the shore, which I now considered as
work for them. I then was a little revived, and thought, if it were no
would sacrifice me: but my wishes were vain; for we were so quartered
copious perspirations, so that the air soon became unfit for
opportunity, when they thought no one saw them, of trying to get a
last took notice of my surprise; and one of them, willing to increase
filled me with surprise. What struck me first was that the houses were
might not an African ask you, learned you this from your God, who says
Louisbourg under the command of Admiral Boscawen, in 1758._
I was very much affrighted at some things I saw, and the more so as I
having any one to talk to, which made my life a burden, when the kind
my own country, and this made me very happy. I was quite rejoiced at
would kill and eat me. There was on board the ship a young lad who had
first, and afterwards me. Though this hearing relieved my mind a
good friend Dick came shortly towards me, and I took an opportunity to
pavement of the streets in Falmouth; and, indeed, any object I saw
not sell one another, as we did, I was much pleased; and in this I
when my master asked me if I would stay there with her behind him, as
Nore, where the Roebuck lay, a man of war's boat came alongside to
of our time was spent in play. I remained in this ship a considerable
long wished for in vain. But the very moment the word of command was
cut my left leg off at different times, apprehending a mortification;
board of her I was surprised at the number of people, men, women, and
soon made, and got into a very commodious harbour called St. George,
board our ship to dine. On this occasion our ships were dressed with
and had a mind to fight us, they might have done us great mischief.
The sea grew now much smoother; and the wind lulling, the seventy-four
French ships--A particular account of the celebrated
with surprise that I never felt half the alarm at any of the numerous
she told me I should. She had formerly asked my master to let me be
ordered on board; and, to my no small grief, I was obliged to leave my
would accompany him, he would bring me to her. Improbable as this
on the horses or mules, so that I could not fall, and setting them off
1759. Here we remained with all our sails unbent, while the fleet was
line of battle some miles ahead. We immediately chased them till about
quitted her, and went in the broken and only boat we had left on board
scarcely had water enough at the last to throw on it. We were also,
recovered of his wounds, the admiral appointed him captain of the Ætna
house, where I was treated very kindly. This benevolent boy and I were
said he had seen many things very awful, and had been warned by St.
his face. As Mr. Mondle must inevitably have perished from this
command of the landing. This was on the 8th of April. The French were
likewise from those of the French. One of the largest of their shells
thus and mount him. As soon as I was on the horse's back I began to
After our ship was fitted out again for service, in September she went
and dress hair a little, and also to read in the Bible, explaining
never once supposed, in all my dreams of freedom, that he would think
then to cheer me, and told me he could not sell me, and that they
immediately left the cabin, filled with resentment and sorrow. The
Portuguese white men among a lot of slaves.]
1763 to 1766--Address on it to the planters._
me with the wings of his mercy, and by his invisible but powerful hand
procure my escape. However, after we had sailed, and his trick was
relief, to my inexpressible anguish our ship had got under way. What
Salute with groans unwelcome morn's return,
Still urges."
by the messenger that my fate was then determined. With fluttering
afterwards found of infinite service to me. I went on board again, and
Mr. King dealt in all manner of merchandize, and kept from one to six
of feeling, they were always glad to work for him in preference to any
he was not without consolation. Extortion and rapine are poor
situation, and made me bless God for the hands into which I had
who make this assertion exclaim the most loudly against the abolition
vessels to carry them to other islands, or to America, I have known
field negroes. Their huts, which ought to be well covered, and the
and as happy as the condition of slavery can admit. I myself, as shall
he was delivered up again to his master. This Christian master
No rest!"
committed acts of violence on the poor, wretched, and helpless
as Europeans. By the 329th Act, page 125, of the Assembly of
daughters of the French planter less his children by being begotten on
man used to tell me many melancholy tales of himself. Generally, after
slave-trade to debauch men's minds, and harden them to every feeling
climate, where nature, though prodigal of her bounties in a degree
FOOTNOTES:
[Footnote T: Benezet's Account of Guinea, p. 16.]
they are too shocking to yield delight either to the writer or the
deal of money by his good management in carrying passengers from one
entreaties, after I had been several times with him, one day, to my
to the Lord to be with me; and at one of our trips to St. Eustatia, a
some time before. And I had not been long trading for myself in the
gaining more by three times than I ever did by any venture in my life
sell them; and Providence was more favourable to us than we could have
the water, to which the parson consented, and the two lovers went in
my part to obtain it. In process of time I became master of a few
on board, the punt was overset with us four times; the first time I
a child that he was always free, and no one had ever claimed him as
scene of horror to which I had been before a stranger. Hitherto I had
the swiftest sailing vessels in the West Indies, and I could be at no
to my advantage hereafter, when I did not in the least think of it;
in the year 1765; and during the time we were loading her, and getting
live with him on any condition, and that I certainly would run away
always came on board according to his orders; and he did really
gave me a large piece of silver coin, such as I never had seen or had
person I never before beheld in my life; this made such an impression
prayed the Lord therefore to spare me; and I made a promise in my mind
obtain any thing for it; for, being a negro man, I could not oblige
negroes in his yard, he and a ruffian of a white man he had in his
should have been. The worthy man nursed and watched me all the hours
quantity of goods with me. Accordingly, when we had delivered our old
pleased to satisfy me; so I quitted them, and soon after, as I was
without repining, and we went to St. Eustatia. After we had discharged
recompense me for my trouble, the Captain promised me ten pounds, when
came to the smallest, and had opened it, we saw it was full of papers,
This speech seemed to confound him; he began to recoil: and my heart
affection and reverence, and left the room, in order to obey my
kindness; and, having received it and paid him, I hastened to my
presents do manumit, emancipate, enfranchise, and set free,
new appellation, to me the most desirable in the world, which was
this state of serenity we sailed for St. Eustatia; and, having smooth
man; and when Mr. Read applied to him to deliver me up, he said he
being determined to stand my ground; but at length, by the prevailing
almost distracted. He went immediately for the warrant, and, after
would not be offended at what had passed between us, and swore he
the bullocks were near being drowned, and four or five of them died.
him. Indeed I had every reason in the world to be attached to him;
by as high a title as any free man in this place possessed. When the
to Georgia--Meets with another storm, and is obliged to put
extraordinary.
I was upon deck the wind, which had been pretty high, having abated a
for cursing the vessel on which my life depended. My spirits at this
if I had given them the least hint of it. However the hatches were not
fatigue; and, what was yet more distressing, we could not avoid having
danger they were in? for, if the wind had but raised the swell as it
people; 'And therefore,' said I, 'let us go on shore here, and perhaps
towards New Providence. We had no more than two musket load of
our terror so great, that we expected nothing but death to deliver us.
circumstance which we could not make out the meaning of. Our captain,
We told the people of the wrecker the condition of our vessel, and we
would have gone to pieces, and each moment to be our last; so much so
fastened to lines, in order to catch the buoy: at last we caught it,
board and helped to load the sloop, though we had only our victuals
and, by using our greatest exertions, we got the vessel off. The next
they did with me. I told them that I was a free man, and just arrived
looking for that you lost:' and the other swore immediately that I was
ceremony to the satisfaction of all present; after which I bade adieu
agreeable voyage, we got safe to our intended port. While I was on
no victuals allowed us, and I could not get my money nor wages, I
island. Some of them, on this, went with me to the captain, and
severe than most of my countrymen); and adieu to the angry howling,
him that he had used me very ill, after I had been such a faithful
neighbour in the same court who taught the French horn. He used to
to try the sea again in quest of more money, as I had been bred to it,
which afforded me opportunities to see the country around. I also
even of a lamb to weigh from eleven to thirteen pounds. The fat of
other commodities, we sailed for London, and arrived in July
laden with different goods. The people of these caravans are quite
I met once more with my former kind of West India customers. A white
thanked us, glad to get off so easily, and ran into the bushes, after
here. In particular I was present when a poor fellow was tied up and
following. On my return to London, I waited on my old and good master,
manner of combustibles, particularly with tow and aquafortis, and many
sun did not set. The weather now became extremely cold; and as we
wounded a sea-horse, which dived immediately; and, in a little time
ice, and was very near being drowned; but providentially some people
proceeded in this manner till we got into the open water again, which
for London, and on the 30th came up to Deptford. And thus ended our
and, by the grace of God, proved afterwards a mercy to me; it caused
which availed me nothing, for the fear of eternity daily harassed my
to him a very clever black man, John Annis, as a cook. This man was on
me to use the following deception: I whitened my face, that they might
time convinced I was altogether unprepared for that awful summons.
me a small space of time to repent of my follies and vile iniquities,
I had a great desire to read the bible the whole day at home; but not
going to my supposed banquet. I also wished much for the company of
full of buns, which they distributed about; and each person
my mind for some time, not knowing what to do; whether to hire a bed
those whom the scripture calls the excellent of the earth. I heard the
day to me 'Go ye cursed,' &c. &c. for God would appear faithful in his
was a wonderful sermon; he clearly shewed that a living man had no
shortness of time, and the length of eternity, and that no
began to fear death; I fretted, mourned, and prayed, till I became a
following manner:
reproach, sin, and shame. I then clearly perceived that by the deeds
the fears of death, that weighed me down before, now lost their
The worth of a soul cannot be told.--May the Lord give the reader an
whereby we must be saved, but only Christ Jesus.' May God give the
appointed time.
How did uncommon dread prevail!
Troubled my thoughts,' while doubts and fears
When sable clouds began to rise
What thou ordain'st willing I'll bear;
Tho' I am nothing else but sin,
I this have seen; and gladly own
Mosquito Indians--Successful device of the author's to quell
near to me were much astonished in seeing me thus calm and resigned;
been above fifty years in building, as I heard, though it was not then
his offer, as I could not in conscience conform to the opinions of his
dreamed that I saw a boat immediately off the starboard main shrouds;
habitation. O that men would praise the Lord for his goodness and for
fine sloop, about 150 tons. He had a mind for a new adventure in
I taught him in the compass of eleven days all the letters, and he
not drink nor carouse with these ungodly actors, nor would he be with
fourteenth we arrived at Jamaica. One Sunday while we were there I
plant different kinds of vegetables, which had a quick growth. While
dwelling; and then they generally carried whatever they brought to us,
plentiful here; and then we could not get them away from our place.
friendly chiefs, who was our nearest neighbour, and also took his
rid of our troublesome guests. The Musquito people within our
assemblage of these people, who received us very kindly. The mirth had
salmon, and it had a most fragrant smell, but I could not eat any of
Irving, whom he had seen that day. This account was of no use; he
silent, seeing not one white man on board who said a word on my
and swore heavily and dreadfully, that he would shoot me that instant,
therefore at different times unable to manage the canoe, for the
